{
  "$schema": "../../schemas/native-agentteams-cloud-skill-run-evidence.v0.1.schema.json",
  "action_request": {
    "action": "github.release.create",
    "created_at": "2026-08-02T08:25:18.226759Z",
    "evidence_requirements": [
      "SOURCE_PIN",
      "TEST_RESULT",
      "TAG_STATE",
      "RELEASE_MANIFEST",
      "CLOUD_CONTEXT"
    ],
    "idempotency_key": "alibaba-cloud-preflight-20260802",
    "parameters": {
      "draft": true,
      "tag": "competition-demo-not-created"
    },
    "parameters_sha256": "9c38fecc71c8e5cb3dfed538e6536a1f5772c0db9a609e4f27911f72f8f17508",
    "request_id": "aar-alibaba-cloud-preflight-20260802",
    "requested_by": {
      "agent_id": "release-steward",
      "team_id": "titmas-action-gate"
    },
    "schema_version": "0.1.0",
    "target": {
      "provider": "github",
      "repository": "joy7758/titmas-agent-action-gate",
      "resource_ref": "release/competition-demo-not-created"
    },
    "uncertainty": [
      "Cloud context is read-only evidence and grants no deployment or release authority.",
      "This native Worker turn creates no cloud resource and produces no Action Gate decision."
    ]
  },
  "agent_evidence_profile": {
    "actor": {
      "id": "actor:cloud-context-inspector",
      "name": "cloud-context-inspector",
      "runtime": "titmas-action-gate-local-service",
      "type": "agent"
    },
    "constraints": [
      {
        "description": "Required evidence type CLOUD_CONTEXT is present.",
        "id": "constraint:cloud-context"
      }
    ],
    "evidence": {
      "artifacts": [
        {
          "artifact_id": "artifact:aar-alibaba-cloud-preflight-20260802:cloud-context-preflight",
          "digest": "sha256:8405ca82eff295e49781935fda0226e3d7cc19d65f4b8466e494f1f09c0443d7",
          "locator": "urn:titmas:artifact:aar-alibaba-cloud-preflight-20260802:cloud-context-preflight",
          "type": "execution-log"
        }
      ],
      "id": "evidence:aar-alibaba-cloud-preflight-20260802:cloud-context-preflight",
      "integrity": {
        "artifacts_digest": "sha256:10ed733dbc8d3802039ec734d086607dde3a6f5c63cbe3f8800f32716eb6780f",
        "references_digest": "sha256:9f6880334610fd4268855b90b628192e91e7cf5d8cc025e880e987601193ddf4",
        "statement_digest": "sha256:40c1dd59dd8b2371fab286589e7ae16dbd462816bf32c35836681e8f64af18ca"
      },
      "operation_ref": "op:aar-alibaba-cloud-preflight-20260802:cloud-context-preflight",
      "policy_ref": "policy:aar-alibaba-cloud-preflight-20260802:cloud-context-preflight",
      "references": [
        {
          "digest": "sha256:2c2c7cd54b69093ec9ac8b13e3ddbe543b5854886c3bd76e9c7ab4cbc6aae5bd",
          "locator": "urn:titmas:action-request:aar-alibaba-cloud-preflight-20260802",
          "object_id": "obj:aar-alibaba-cloud-preflight-20260802",
          "ref_id": "ref:aar-alibaba-cloud-preflight-20260802:request",
          "role": "input"
        },
        {
          "digest": "sha256:ccffcf86fa605344ad27bde6c91d5f611b31a24d8895f05ee0b99fee9e3e305d",
          "locator": "urn:titmas:action-output:aar-alibaba-cloud-preflight-20260802:cloud-context-preflight",
          "object_id": "obj:aar-alibaba-cloud-preflight-20260802:cloud-context-preflight-output",
          "ref_id": "ref:aar-alibaba-cloud-preflight-20260802:cloud-context-preflight-output",
          "role": "output"
        }
      ],
      "subject_ref": "obj:aar-alibaba-cloud-preflight-20260802"
    },
    "operation": {
      "description": "TITMAS Action Gate cloud-context-preflight evidence for one bounded request.",
      "id": "op:aar-alibaba-cloud-preflight-20260802:cloud-context-preflight",
      "input_refs": [
        "ref:aar-alibaba-cloud-preflight-20260802:request"
      ],
      "output_refs": [
        "ref:aar-alibaba-cloud-preflight-20260802:cloud-context-preflight-output"
      ],
      "policy_ref": "policy:aar-alibaba-cloud-preflight-20260802:cloud-context-preflight",
      "result": {
        "status": "failed",
        "summary": "cloud-context-preflight evidence captured"
      },
      "subject_ref": "obj:aar-alibaba-cloud-preflight-20260802",
      "type": "alibabacloud.resourcecenter.search-resources"
    },
    "policy": {
      "constraint_refs": [
        "constraint:cloud-context"
      ],
      "id": "policy:aar-alibaba-cloud-preflight-20260802:cloud-context-preflight",
      "name": "titmas-action-gate-evidence-requirements"
    },
    "profile": {
      "name": "execution-evidence-operation-accountability-profile",
      "version": "0.1"
    },
    "provenance": {
      "actor_ref": "actor:cloud-context-inspector",
      "id": "prov:aar-alibaba-cloud-preflight-20260802:cloud-context-preflight",
      "input_refs": [
        "ref:aar-alibaba-cloud-preflight-20260802:request"
      ],
      "operation_ref": "op:aar-alibaba-cloud-preflight-20260802:cloud-context-preflight",
      "output_refs": [
        "ref:aar-alibaba-cloud-preflight-20260802:cloud-context-preflight-output"
      ],
      "subject_ref": "obj:aar-alibaba-cloud-preflight-20260802"
    },
    "statement_id": "eeoap:aar-alibaba-cloud-preflight-20260802:cloud-context-preflight",
    "subject": {
      "digest": "sha256:2c2c7cd54b69093ec9ac8b13e3ddbe543b5854886c3bd76e9c7ab4cbc6aae5bd",
      "id": "obj:aar-alibaba-cloud-preflight-20260802",
      "locator": "urn:titmas:action-request:aar-alibaba-cloud-preflight-20260802",
      "type": "action-request"
    },
    "timestamp": "2026-08-02T08:26:06.210366Z",
    "validation": {
      "evidence_ref": "evidence:aar-alibaba-cloud-preflight-20260802:cloud-context-preflight",
      "id": "validation:aar-alibaba-cloud-preflight-20260802:cloud-context-preflight",
      "method": "schema+reference+consistency",
      "policy_ref": "policy:aar-alibaba-cloud-preflight-20260802:cloud-context-preflight",
      "provenance_ref": "prov:aar-alibaba-cloud-preflight-20260802:cloud-context-preflight",
      "status": "verifiable",
      "validator": "agent-evidence validate-profile"
    }
  },
  "agent_evidence_receipt": {
    "bundle_sha256": "b3f2e448c8386d56d7c277fe872e9793580ca99b2d6abac9df76dab10a63ee11",
    "checks": [
      {
        "check_id": "ATTACHMENT_DIGEST",
        "passed": true
      },
      {
        "check_id": "SUBJECT_ID",
        "passed": true
      },
      {
        "check_id": "SUBJECT_LOCATOR",
        "passed": true
      },
      {
        "check_id": "SUBJECT_DIGEST",
        "passed": true
      },
      {
        "check_id": "EVIDENCE_TYPES",
        "passed": true
      },
      {
        "check_id": "SCHEMA",
        "passed": true
      },
      {
        "check_id": "REFERENCES",
        "passed": true
      },
      {
        "check_id": "CONSISTENCY",
        "passed": true
      },
      {
        "check_id": "INTEGRITY",
        "passed": true
      }
    ],
    "evidence_types": [
      "CLOUD_CONTEXT"
    ],
    "request_binding": {
      "action": "github.release.create",
      "parameters_sha256": "9c38fecc71c8e5cb3dfed538e6536a1f5772c0db9a609e4f27911f72f8f17508",
      "provider": "github",
      "repository": "joy7758/titmas-agent-action-gate",
      "resource_ref": "release/competition-demo-not-created"
    },
    "request_id": "aar-alibaba-cloud-preflight-20260802",
    "schema_version": "0.1.0",
    "status": "VALID",
    "verified_at": "2026-08-02T08:26:06.212342Z",
    "verifier": {
      "distribution_sha256": "3bec73551c252c4665ea54e49243190d2d27df430a92b5c6d1846d4e025d0b8e",
      "name": "agent-evidence",
      "version": "0.6.0"
    }
  },
  "authority": {
    "deterministic_action_gate_sole_authority": true,
    "worker_decision_record_count": 0,
    "worker_produced_gate_outcome": false
  },
  "cloud_context": {
    "checks": [
      {
        "check_id": "SKILL_SOURCE_HASH",
        "passed": true
      },
      {
        "check_id": "READ_ONLY_OPERATION_ALLOWLIST",
        "passed": true
      },
      {
        "check_id": "USER_PARAMETER_CONFIRMATION",
        "passed": true
      },
      {
        "check_id": "CREDENTIAL_REFERENCE_PRESENT",
        "passed": true
      },
      {
        "check_id": "READ_ONLY_POLICY_REFERENCE",
        "passed": true
      },
      {
        "check_id": "LIVE_READ_ONLY_IDENTITY_BINDING",
        "passed": true
      },
      {
        "check_id": "CLI_EXIT_STATUS_ZERO",
        "passed": true
      },
      {
        "check_id": "PAGINATION_COMPLETE",
        "passed": true
      },
      {
        "check_id": "NONEMPTY_VISIBLE_RESULT",
        "passed": false
      },
      {
        "check_id": "SANITIZED_OUTPUT_ONLY",
        "passed": true
      }
    ],
    "credential": {
      "credential_ref": "sha256:e57f614cb4f8c0a70c79a3da9ded4b50155972476f07d08a1d61b36d6d7b34d1",
      "permission_identity_ref": "sha256:d5dfdaf092de944ea6a34dbc7edc16903b6aac180f69c0fb48d8b1a903c4dda1",
      "permission_policy_ref": "sha256:0f96840f957667994e562b1792758ac205b54b596be3566668f598f457cb536f",
      "permission_role_ref": "sha256:c172f1e2c0106e474ae5e0327854abf05c051f7e9a59fea9b1d97ae0b4b18a3f",
      "read_only_policy_verified": "PASS"
    },
    "invocation": {
      "argv_template_sha256": "8677a4d1979f1fd7f8769b58657e6a25d503f1ab3cf54a039d11b245bd35d1a5",
      "cli_version": "3.4.11",
      "command": "aliyun resourcecenter search-resources --max-results 1 --include-deleted-resources=false --endpoint resourcecenter.aliyuncs.com --profile <runtime-profile> --user-agent AlibabaCloud-Agent-Skills/alibabacloud-resourcecenter-search",
      "exit_status": 0,
      "invoked": true,
      "next_token_present": false,
      "provider_http_attempts": "NOT_ASSESSED",
      "region_count": 0,
      "request_id_ref": "sha256:39959b82074d9da39ad2020ffd47e8cbb5b7d969334a7b0dc1b92aec82f352f9",
      "resource_type_count": 0,
      "result_class": "EMPTY_RESULT",
      "returned_resource_count": 0,
      "steps": [
        {
          "effect": "LOCAL_READ",
          "exit_status": 0,